{
  "schema_version": "3.0",
  "feature_version": "keypoints-9-v1",
  "baseline": [
    [
      0.5,
      0.4
    ],
    [
      0.52,
      0.38
    ],
    [
      0.48,
      0.38
    ],
    [
      0.54,
      0.4
    ],
    [
      0.46,
      0.4
    ],
    [
      0.51,
      0.43
    ],
    [
      0.49,
      0.43
    ],
    [
      0.6,
      0.6
    ],
    [
      0.4,
      0.6
    ]
  ],
  "frames": [
    {
      "t_ms": 21000,
      "p": [
        [
          0.5,
          0.4,
          0.99
        ],
        [
          0.52,
          0.38,
          0.99
        ],
        [
          0.48,
          0.38,
          0.99
        ],
        [
          0.54,
          0.4,
          0.9
        ],
        [
          0.46,
          0.4,
          0.9
        ],
        [
          0.51,
          0.43,
          0.99
        ],
        [
          0.49,
          0.43,
          0.99
        ],
        [
          0.6,
          0.6,
          0.99
        ],
        [
          0.4,
          0.6,
          0.99
        ]
      ]
    },
    {
      "t_ms": 21100,
      "p": [
        [
          0.55,
          0.4,
          0.99
        ],
        [
          0.52,
          0.38,
          0.99
        ],
        [
          0.48,
          0.38,
          0.99
        ],
        [
          0.5900000000000001,
          0.4,
          0.9
        ],
        [
          0.51,
          0.4,
          0.9
        ],
        [
          0.51,
          0.43,
          0.99
        ],
        [
          0.49,
          0.43,
          0.99
        ],
        [
          0.6,
          0.6,
          0.99
        ],
        [
          0.4,
          0.6,
          0.99
        ]
      ]
    },
    {
      "t_ms": 21200,
      "p": [
        [
          0.54,
          0.4,
          0.99
        ],
        [
          0.52,
          0.38,
          0.99
        ],
        [
          0.48,
          0.38,
          0.99
        ],
        [
          0.54,
          0.4,
          0.9
        ],
        [
          0.46,
          0.4,
          0.9
        ],
        [
          0.51,
          0.43,
          0.99
        ],
        [
          0.49,
          0.43,
          0.99
        ],
        [
          0.6,
          0.6,
          0.99
        ],
        [
          0.4,
          0.6,
          0.99
        ]
      ]
    },
    {
      "t_ms": 21300,
      "p": null
    },
    {
      "t_ms": 21400,
      "p": null,
      "valid": false
    },
    {
      "t_ms": 21500,
      "p": [
        [
          0.5,
          0.46,
          0.99
        ],
        [
          0.52,
          0.38,
          0.99
        ],
        [
          0.48,
          0.38,
          0.99
        ],
        [
          0.54,
          0.4,
          0.9
        ],
        [
          0.46,
          0.4,
          0.9
        ],
        [
          0.51,
          0.43,
          0.99
        ],
        [
          0.49,
          0.43,
          0.99
        ],
        [
          0.6,
          0.6,
          0.99
        ],
        [
          0.4,
          0.6,
          0.99
        ]
      ]
    }
  ]
}
